Legend Systems Private Limited (Precision Biometric),http://precisionbiometric.co.in/,2001,Mathew Chacko,Mathew Chacko,"Chennai, India",,"No.22, Habibullah Road
Thyagaraya Nagar
Chennai,  600 017
India",,00 91 44 4219 9524,,,"Fingerprint Devices, Iris, BioNIX, InnaIT-CBS, UID Kit, InnaIT-SDK, FI Kit, Attendance and Access Control Systems",,,,,,,,,,"Fingerprint Devices: (1) PB100e: PB100e is a Radio Frequency (RF) based fingerprint scanner with a USB 
interface widely used for civilian use like Financial Inclusion, two 
factor authorization, identification, authentication, enrollment, 
security etc. (2) CSD200: The CSD200, 3M Cogent’s single-digit optical fingerprint scanner, is 
housed in a durable and compact casing and captures high quality flat 
impressions in a fast, reliable, and easy-to-learn way. Its advanced 
optical system enhances ambient light rejection. (3) CS500: The Cogent CS500e LiveScan solution, featuring the CS500e scanner, is  
an  easy-to-learn,  user-friendly system that captures rolled and flat 
fingerprints. The software guides the  operator  through  the  capture 
process   with   on-screen   prompts   and   graphical displays. 
Real-time image quality check, sequence verification, auto-center, and 
auto-contrast functions ensure the capture of high-quality prints. Iris: (1) CIS202: CIS202 is the latest Iris Scanner from 3M Cogent. This rugged dual iris 
capture scanner offers a robust yet low cost solution for rapid and 
simultaneous iris capture in less than two seconds. This USB-powered 
scanner enables users to safely capture high resolution iris images, 
while eliminating intrusive capture position or user discomfort. (2) CS101: CS101 is the latest Multi-function biometric Scanner and is considered 
as the most accurate iris scanner for authentication which detects the 
person’s identity with mathematical analysis of the random patterns that
 are visible within the iris of an eye from some distance. The iris 
remains stable over time as long as there are no injuries and a single 
enrolment scan can last a lifetime. Solutions: (1) BioNIX: A solution to manage the identity of your organisation’s privileged 
accounts. This is a robust solution using our advanced Radio Frequency 
based fingerprint scanner. A login control application that strengthens 
the login security by using biometric instead of password. (2) InnaIT-CBS: InnaIT-CBS is the most mature biometric technology, in which 
authentication would remove loopholes in security in applications, 
facilitate faster, simplified, accurate, and non-intrusive 
authentication procedures, which also increases productivity, and 
provides an audit trail that cannot be repudiated. (3) UID Kit: Precision Infomatic (M) Pvt Ltd provides the AADHAAR/UID Enrolment Kit for the Registrars, Enrolment 
agencies and Outsourcing agencies who have taken the work order from 
UIDAI for enrolling the residents of respective regions. (4) InnaIT-SDK: InnaIT-SDK is intended for the development of fingerprint based applications and solutions. (5) FI Kit: Financial Inclusion is the delivery of banking services at affordable 
costs to vast sections of disadvantaged and low income groups including 
households, enterprises, SMEs, traders. (6) Attendance and Access Control: http://precisionbiometric.co.in/attendance-access.php. Generally, all this information is found through the ""products"" and ""solutions"" sections in the website: http://precisionbiometric.co.in/",,,"STQC, ISO 9001: 2008, BioApi",N/A,1,-,,"Precision Infomatic (M) Pvt Ltd have supplied around 25,000 UID/AADHAAR kits across India for the enrolment phase of the project (http://precisionbiometric.co.in/uid.php) "
Raviraj Technologies,http://www.ravirajtech.com/index.html,,Mr. Raviraj Padwal ,Mr. Raviraj Padwal ,"Pune, India",,"319 Narayan peth, Pune, Maharashtra, India, Zip/Postal : 411030", info@ravirajtech.com,00 91 20 24475992,,,"Biometric access control products, Biometric time attendance recorders, Biometrics Identification Authentication, USB Fingerprint Scanner, Fingerprint Car Lock, Fingerprint Modules, Fingerprint Software products, Fingerprint Scanners: http://www.ravirajtech.com/product.html",,,,,,,,,,"Biometric access control products, Biometric time attendance recorders, 
Biometrics Identification Authentication, USB Fingerprint Scanner, 
Fingerprint Car Lock, Fingerprint Modules, Fingerprint Software 
products, Fingerprint Scanners: http://www.ravirajtech.com/product.html","India, 
                                                        USA (New York, California), UK, Dubai, UAE, Oman, 
                                                        Bahrain, Saudi Arabia, Australia, south Africa, 
                                                        Canada, America, middle east, Europe, Asia, 
                                                        Argentina, Austria, Azerbaijan, Bahamas,  
                                                        Bangladesh, Belgium, Bhutan, Brazil, Brunei, 
                                                        Bulgaria, Burma, Cameroon, Canada, Chile, China, 
                                                        Colombia. Congo, Costa Rica, Croatia, Cuba, Cyprus, 
                                                        Czech Republic, Denmark, East west north south, 
                                                        Ecuador, Egypt,  England, c Laos, Malaysia, 
                                                        Maldives, Islands, Mauritius, Mexico, Myanmar, 
                                                        Nepal, The Netherlands, New Zealand, Nigeria, 
                                                        Ireland, Norway, Oman, Pakistan, Philippines, 
                                                        Poland, Portugal, Qatar, Romania, Russia, Saudi 
                                                        Arabia, Scotland, Seychelles, Sierra, Property Singapore, South 
                                                        Africa, Spain, Sri Lanka, Sudan Sweden, Switzerland, 
                                                        Syria, Taiwan, Tanzania, impact 
                                                        components Thailand, Trinidad, Tunisia, 
                                                        Turkey, United Arab Emirates, United Kingdom, Britain, United States of 
                                                        America,  Vatican, Venezuela, Vietnam, Wales, 
                                                        Zimbabwe Karnataka, Biometric Madhya Pradesh, 
                                                        Biometrics Maharashtra, Orissa, Punjab",,"enBioScan-C1 product: USB Optical FBI PIV certified fingerprint  scanner enBioScan-C1 -STQC Aadhaar Certified Live Scan fingerprinting. (1) FBI PIV certified, (2) STQC certified, (3) CE certification for Fingerprint Reader, (4) FCC certification for Fingerprint Reader: http://www.ravirajtech.com/FBI-PIV-certified-fingerprint-scanner-enBioScan-C1.html",N/A,1,4,,"Raviraj Technologies is an Indian company which supplies multiple countries all around the world: http://www.ravirajtech.com/ Additionally, Raviraj Technologies sells Aadhaar certified products (UID): http://www.ravirajtech.com/FBI-PIV-certified-fingerprint-scanner-enBioScan-C1.html"
Smartmatic,http://www.smartmatic.com/contact/offices-contacts/,2000,Antonio Mugica,Antonio Mugica,"London, UK",http://www.smartmatic.com/contact/offices-contacts/ (worldwide),"505-A 5th Floor D-4, Rectangle 1
District Centre, Sacket
New Delhi 110017",india@smartmatic.com,00 91 9 999769498,@smartmatic,,"(Biometric) Election Solutions and ID Management Solutions, ",,,,,,,,,,"Biometric Election Solutions (http://www.smartmatic.com/solutions/electoral-solutions/view/article/next-generation-voting-technology/#.UoYPa85_W8Y), Biometric Identity Management Solutions (http://www.smartmatic.com/solutions/id-management-solutions/view/article/comprehensive-biometric-identity-management/#.UoYPns5_W8Y)","CIDLIS (Colombia), Commission on Elections (Philippines), Electoral Commission of Zambia, Electoral Superior Court (Bolivia), Electoral Superior Court (Brazil), Federal Electoral Institute (Mexico), Federal Public Service Interior (Belgium), La Punta University (Argentina), National Electoral Council (Ecuador), National Electoral Council (Venezuela), National Electoral Office (Argentina), National Identity Office (Haiti), National Registry (Colombia), Secretariat of the Interior (Mexico), TransCaribe (Colombia), United Nations Development Programme (http://www.smartmatic.com/customers/). Additionally, Smartmatic has offices across the globe and is possibly supplying biometric technology to other countries as well. ",,,N/A,1,4,http://www.smartmatic.org/en/newsroom/,"Smartmatic is the world's leading electoral automation company, having run more large-scale automated elections around the globe than anyone else.Smartmatic people and technology have helped register more than 2.2 billion votes in over 3,500 elections (http://www.smartmatic.com/about-us/history/)"
Spy Impex,http://www.tradedir.in/company/spy-impex-69292,2008,,Mr. Suresh Savaliya,"Gujarat, India",,"66, DHRUVTARAK SOCIETY, OPP. HARIOM MILL, VED ROAD, Surat - 395004, Gujarat, India",,00 91 261 2510073,,,"Huge variety of spy cameras, phone monitoring software and GPS vehicle tracking systems: http://www.tradedir.in/company/spy-impex-69292 ",,,"Cell phones with spy wireless cameras, Cell phone spy software, Blackberry Spy Phone Software, Windows Mobile Spy Phone Software, Spy Phone Generator 3rd Edition S60v3, All in One Spy Phone, Mobile Phone Interceptor, Smartphone Spy Software, Spy Mobile Phone Software, Mobile Call Interceptor Software: http://www.tradedir.in/company/spy-impex-69292",,,GPS Vehicle Tracking System: http://www.tradedir.in/company/spy-impex-69292,,"Coca Cola Tin Camera, Hidden Pen Camera, Spy Watch Camera, Spy mini CCTV camera with transmitter, Car key camera, Hidden camera sunglasses and much more spy cameras: http://www.tradedir.in/company/spy-impex-69292",,,"The public, companies, hotels, and possibly law enforcement",,,http://www.tradedir.in/privacy/,"6, 5, 10, -","1, 2, -",,"Spy Impex sells a wide range of spy products, including coca cola tin cameras...!"
Aryabhatta Infosys,http://www.aryainfo.com/,,,,"Gujarat, India",,"A/ 61, Vishranti Estate, Near Narayan Gardens, Off Yash Complex, Gotri Road, Vadodara - 390 021, Gujarat, India",response@aryainfo.com,00 91 265 2370173,,,"Biometric devices, RFID, Access Control Systems, Voice Recognition, Face Recognition Systems",,,,Voice Recognition Systems: http://www.aryainfo.com/index.php/biometrics/biometricdevices/voicerecognitionsystems,Face Recognition Systems: http://www.aryainfo.com/index.php/biometrics/biometricdevices/facerecognition,"RFID Card based Attendance Recorders & Access Controllers: http://www.aryainfo.com/index.php/biometrics/rfid
",,,,"Fingerprint recorders (http://www.aryainfo.com/index.php/biometrics/biometricdevices/fingerprintar), Hand Geometry (http://www.aryainfo.com/index.php/biometrics/biometricdevices/handgeometry), Palm Vein (http://www.aryainfo.com/index.php/biometrics/biometricdevices/palmvein), Retina Scanner (http://www.aryainfo.com/index.php/biometrics/biometricdevices/retinascanner), Iris Scanner (http://www.aryainfo.com/index.php/biometrics/biometricdevices/irisscanner)",Corporations: http://www.aryainfo.com/index.php/clients,,,N/A,"1, 4, 3, 5, -",2,,
Savant Automation,http://www.indiamart.com/savant-automation/,,,Mr. Srinivasan,"Chennai, India",,"No. 2/2, Kumaran Avenue, Valasarawakkam, Chennai - 600 087, Tamil Nadu, India",,00 91 9176265999,,,"CCTV cameras, Access control systems, RFID solutions",,,,,,RFID solutions: http://www.indiamart.com/savant-automation/products.html,,"Solutions based on the range in IR or Night Vision or Day / Night 
Cameras, CCD or Dome Camera, High Speed Dome Camera, IP Camera, GSM 
Camera, PTZ Cameras, Vari Focal Dome, Flexi Dome Camera, Bullet camera, 
Vandal Proof Cameras, Hidden Cameras, Motion Detection Cameras and more (http://www.indiamart.com/savant-automation/products.html)",,"Access Control Systems (RFID,Smart Card, Proximity Card, Biometric, Voice Recognition, Iris): http://www.indiamart.com/savant-automation/products.html","Companies, hotels, public",,,N/A,"5, 6, 1, -","1, 2, -",,
"
Icon Infosystems","http://www.indiamart.com/icon-infosystems/, http://www.iconinfosystems.co.in/",,,,"Bangalore, India",,"No. 572,17th A Main, 6th F Cross, 6th Block, Kormangala, Bengaluru - 560095, Karnataka, India",,00 91 80 41627823,@Iconinfosystems,,"Voice Recognition software, Call recording and monitoring solutions",,,Call recording and monitoring solutions: http://www.indiamart.com/icon-infosystems/products.html#cti-software,Voice Recognition software: http://www.indiamart.com/icon-infosystems/products.html#cti-software,,,,,,,"The public, businesses, organizations and possibly law enforcement agencies",,,N/A,"10, 4, -","1, 2, -",,
Mobile Spy India (Retina-X Studios),http://www.mobilespy.co.in/,1997,,James Johns,"Jacksonville, USA","13453 North Main Street
Suite 201
Jacksonville, FL 32218
United States of America","502,Pink Tower, Malviya Nagar, J.l.n. Marg, Jaipur Gpo, Jaipur - 302001","sales@acespy.com,          media@acespy.com",00 1 888 475 5345,@retinaxstudios,,Mobile Spy Software for Mobile Phones,,,"Mobile Spy Software features: (1) Records activity from Facebook, WhatsApp and Twitter messaging services used on the mobile phone. (2) Each incoming and outgoing number is logged along with duration and time stamp. (3) Every text message is logged even if the phone's logs are deleted. Includes full text. (4) All inbound and outbound email activity from the primary email account is recorded. (5) GPS postions are uploaded every thirty minutes with a link to a map. (6) ID information on all cell towers that the device enters into range of is recorded. (7) Every contact on the phone is logged. New contacts added are also recorded. (8) All URL website addresses visited using the phone's browser are logged. (9) All personal tasks that are created are recorded. (10) Every calendar event is logged. Date, time, and locations are recorded. (11) 
All photos and videos taken by the phone are recorded and viewable. (12) Log YouTube videos watched on the phone with link to each video. (13) View the Gmail messages made on the phone with date, to/from addresses, subject and full text. (14) Lets you see what Apps are installed on the phone. (15) Records messenger logs from BlackBerry Messenger, Yahoo, Gtalk, Windows Live, and AOL. (16) Records all iMessages on the iPhone. (17) BlackBerry PIN messages. (18) Block the phone user's access to certain applications. (19) The remote uninstall feature lets you finish and tidy up your monitoring setup without being at the monitored phone. (20) Send SMS commands to the phone.And many more... View: http://www.mobilespy.co.in/spy_features.html 

                                                                                                                                                                                                     
                
                                                                                                                                                                                                          
                                                                                                                                                                
                                                                                                                                                                                                        

                                                                                                                                                                                                ",,,,,,,,The public,"User Legal Agreement: http://www.mobilespy.co.in/user_legal_agreement.html, Mobile Spy Policies: http://www.mobilespy.co.in/legal.html ",,N/A,10,1,,Mobile spying features: http://www.mobilespy.co.in/spy_features.html
SPY Action India Home Products ,http://www.spydelhi.in/,17 years ago,,"Contact persons: PARMINDER SINGH, ARJUN SINGH","New Delhi, India","42/A, Jephson Road,
Near Green Street,
East London,
London - E7 8LZ.","H.0.2162/29 GURU ARJUN NAGAR OPP.
METRO PILLER NUMBER 230 MAIN PATEL NAGAR ROAD
NEW DELHI-110008",actionindiadelhi@gmail.com,00 91 9811251277/ 9811601716,@spyproductdelhi,,"Spy Cameras, Spy Wireless Cameras, GPS trackers, Spy software, CCTV cameras, Spy gadgets, Spy Keylogger Software, Computer Spy software","Spy Keylogger software: There is the PS/2 model, which has the same fittings as a standard PS/2 
keyboard. There is also the USB model, which is compatible with all 
modern keyboards. The third type of keylogger is one concealed within 
the computer keyboard itself (http://www.spydelhi.in/Spy-Keylogger-In-Delhi-India.html). Computer Spy Software is a stealthy monitoring tool which allows you to 
secretly track all activities of computer users, to automatically check systems, including all areas of the system such as email sent, Web sites visited, files operations, every keystroke, username and password, 
online conversation (ICQ, MSN, AIM), and take screen snapshots at set intervals just like a surveillance camera directly pointed at the computer monitor (http://www.spydelhi.in/Spy-Keylogger-Software-In-Delhi-India.html).  ",,"Spy Software for Nokia Mobile: Spyphone - Listen in to surrounding sounds and conversations

Text Interception - Receive duplicate copies of all sent and received text messages

Text Alert - Receive 'Real Time notifications of all calls made and received including the number

Boot/SIM change - Receive Real Time notifications when the target phone is switched on and when the SIM card is changed (http://www.spydelhi.in/Spy-Software-For-Nokia-Mobiles-In-Delhi-India.html), Spy Software Blackberry Mobile: lackberry Spyware for Blackberry phone is the latest BB Messenger Spy 
application designed specifically for Blackberry users. Blackberry 
Spyware allows complete monitoring and tracking of Blackberry phone. 
Blackberry Spyware can be used to reveal truth about your family. 
Moreover, Spy can also be used to monitor the usage of employees by the 
company. blackberry spyware for Blackberry phone enables monitoring of 
calls, text messages and location of Blackberry.
Spy for Blackberry 
phone is a service which can be used by any person for monitoring any 
Blackberry device. Once Blackberry Spyware is installed on the phone, it
 enters into stealth mode hence software Spy is totally undetectable by 
another user (http://www.spydelhi.in/Spy-Software-For-BlackBerry-Mobiles-In-Delhi-India.html), Spy Software for i-Phone (http://www.spydelhi.in/Spy-Software-For-I-Phone-In-Delhi-India.html), Spy Software for Android Mobile Phones (http://www.spydelhi.in/Spy-Software-For-Android-Phone-In-Delhi-India.html), Spy Phone Spftware: a program that you install on a mobile phone which after installation 
secretly records events that happen on the phone and delivers this 
information to your mobile phone via SMS. SPYPHONE also allows you to 
listen to the surroundings of the target mobile, listen to a live phone 
conversation and lets you know the location of the device (http://www.spydelhi.in/Spy-Mobile-Phone-Software-In-Delhi-India.html) ",,,,,"Spy CCTV Camera with micro SD Card: The weatherproof surveillance camera is designed for day / night, indoor
 / outdoor applications with the support of infrared illuminators and 
vandal proof die-cast Plastic housing. The outdoor camera is powered by 
high resolution color 1/3 inch Sony Super HAD CCD image sensor and IR 
lens with the construction of vandal-proof housing. The day / night 
security camera provides color images in bright lighting conditions, and
 in low light or night situations the IR sensor automatically switches 
images to black-and-white (http://www.spydelhi.in/Spy-Cctv-Camera-With-Micro-Sd-Card-In-Delhi-India.html), Spy Camera gadgets: http://www.spydelhi.in/Spy-Camera-In-Delhi-India.html ",,,"All Top and Leading News Channels, Corporate   Sectors, Private Detective Agencies, Investigation Agencies, the public.",,,http://www.spydelhi.in/Privacy-Policy.html,"9, 10, 6, -","1, 2, 4, -",,
Nerve Centrex (NC),http://www.nervecentrex.com/,2005,,,"Bangalore, India",,"No.122, Soudhamini, 3rd Main Road, Gruhalakshmi Layout, 2nd Stage, Kamalanagar, Bangalore - 560079", helpdesk@nervecentrex.com,00 91 80 2323 1228,@nervecentrex,,"Nerve Centrex is partnered with the world leader in network video surveillance – AXIS Communications,
 a company headquartered in Sweden with a 25 year track record of 
delivering state-of-the-art network video surveillance products & 
solutions. Axis products use Axis core technology – the ETRAX and ARTPEC chips. 
With unrivalled network video experience, Axis delivers powerful 
networking functionality and results-enhancing features like motion 
detection, power-over-ethernet, megapixel, HDTV, two-way audio, alarm 
inputs/outputs, active tampering alarm and thermal detection. As their channel partner Nerve Centrex offers network video surveillance
 from standalone sites to large scale enterprise installation with 
wireless connectivity. We offer end-to-end services like network 
cameras, integration, video management software and wireless video 
networks. ",,,,,,,,"Nerve Centrex offers network video surveillance
 from standalone sites to large scale enterprise installation with 
wireless connectivity. We offer end-to-end services like network 
cameras, integration, video management software and wireless video 
networks.",,,Businesses and Governments,,An ISO 9001:2008 Certified Company,N/A,"6, -","2, 4, -",,
Aurora Integrated Systems (AIS),http://www.aurora-is.com/index.php?pg=company&comId=aboutus,,Team of seven graduates from IIT Kanpur,,"Bangalore, India",,"60/4, Srirampura Cross
Opp. JNC ASR, Jakkur Post
Bangalore – 560064
Karnakata, India",contact@aurora-is.com,00 91 80 65836508,,,"UAVs: Urban View and Altius Mk-II, Aerostat systems: SkyView 50, SkyView 100 HD and SkyView 200",,,,,,,,,"Urban View is an Unmanned Aerial Vehicle that enables you to conduct reconnaissance in remote or arduous terrain (http://www.aurora-is.com/index.php?pg=uav&uavId=urbanview). Altius Mk-II is a medium altitude (< 15,000 ft), 
medium range (up to 150 kms LOS), fully autonomous, mission programmable
 fixed wing UAV. The Altius Mk-II system offers ISTAR (Intelligence, 
Surveillance, Target Acquisition & Reconnaissance) capabilities (http://www.aurora-is.com/index.php?pg=uav&uavId=altiusmk2). The SkyView aerostat systems are airborne 
persistent surveillance systems. Their flexibility in deployment and 
scalability ensures that they can meet most mission requirements (http://www.aurora-is.com/index.php?pg=aerostat&aerostatId=skyview50).  ",,"Military and Police (law enforcement agencies)
",,,N/A,"2, -",4,"http://www.thehindu.com/news/cities/Coimbatore/article454391.ece, http://www.hindu.com/2010/10/13/stories/2010101351080200.htm, http://hindu.com/2010/02/04/stories/2010020458460200.htm",
Speck Systems Limited,http://www.specksystems.com/sub-links/Strengths/core-strengths-UAV.htm,,Mr. VS Rao,Mr. Kamichetty Chittaranjan Muni Kumar (KCM Kumar),"Hyderabad, India",,"Electronics Complex
Kushaiguda, Hyderabad – 500062.
Andhra Pradesh, India (and other offices in Delhi, Jammu, Guwahati, Kolkata and Bangalore: http://www.specksystems.com/sub-links/contact-us/offices.htm)",,00 91 040 27125305 / 27125306.,,,UAVs and micro-UAVs,,,,,,,,,"UAVs: Speck has specialized in mini and micro UAVs, mounted with a variety of sensors designed for tactical applications for real-time situational awareness. Speck’s UAV offerings are in strategic partnership with IAI-Malat, 
Israel, along with home-based support and maintenance. The company is 
also working on a defined roadmap for continued R & D in the areas 
of Data Processing, Exploitation and Transfer in the areas of UAV 
technologies (http://www.specksystems.com/sub-links/Strengths/core-strengths-UAV.htm)",,Military,,An ISO 9001 & 27001 Certified Company,End of page Privacy Statement: http://www.specksystems.com/index.htm,2,4,,"Speck was the first Indian company to design, manufacture and fly a micro UAV, indigenously."
Aeron Systems Pvt. Ltd.,http://aeronsystems.en.ec21.com/,2008,,Ashvani Shukla ,"Pune, India",,"S. no. 3/10, Anand Colony, Opp Barate Bung, River Side, Karve Nagar, Pune Maharashtra 411052 India",,00 91 020 65607770,,,UAVs,,,,,,,,,UAVs: http://aeronsystems.en.ec21.com/,,Military,,,N/A,2,4,,
Smart Avionics Co Pvt Ltd.,http://smartavi.en.ec21.com/,1996,,Rajendra Kshirasagar,"Pune, India",,"anil Co-op. hos. society, 775, Shivaji nagar, opp,K.N.P., Erandwane Pune Maharashtra 411004 India",,00 91 20 25671980,,,UAVs,,,,,,,,,UAVs: http://smartavi.en.ec21.com/,,Military,,,N/A,2,4,,
Aerobot,http://aerobot.en.ec21.com/,,,Arjun Naik,"Bangalore, India",,"Num 71, Sy.num. 27, CMC Katha 135-136, Marthalli - KR Puram Ring Road Bangalore 560037 India",,00 91 91 9900106582,,,UAVs,,,,,,,,,UAVs: http://aerobot.en.ec21.com/,,Military,,,N/A,2,4,,
