Infoserve India Private Limited,http://www.infoserveindia.com/products/26/Internet-Monitoring-System.html,1997,,,"New Delhi, India",,"402, World Trade Centre, Babar Road, New Delhi: 110001","info@infoserveindia.com, infoserve@groupsinha.com","011- 23709016, 23709017",,,"Call Data Record (CDR) Miner application, Deep Eye Network Surveillance System, Internet Monitoring System","Deep Eye Network Surveillance System: DeepEye system uses service based targeting which only targets and intercepts data on the following parameters namely: E-mail ID (the mail is sent from), E-Mail ID (the mail is sent to), IP address of a Sub ISP to intercept all traffic from a suspicious network and the keyword content in the mail or attachment. DeepEye uses new interception standards and methods for advanced deep packet inspection IP probing solutions, to extract relevant data and deliver it to IT 
Security teams of the organization. The organization has the option to 
use other packets of the system including Data Mining and Artificial 
Intelligence to provide a comprehensive package. Ability to decode wide range of protocols and applications in Packet switched data which includes: Webmail (includes yahoo, hotmail etc) packets, Outlook express and other such Clients, Chats and other instant messenger, All FTP and TFTP Transfers, All visited websites, Peer to Peer networks, All browsed images, Audio and Video over IP, Voice over Internet Protocol (VOIP). Monitors all mails sent and received. Tracks Yahoo, Hotmail, rediffmail etc., POP and SMTP mails,
all get and post requests, chats and instant messages, all blogs and websites visited, all audio and video over IP Network, all files transfers (FTP and TFTP), all printed documents, all suspect IPs, identify all compromised systems and the attacking servers (http://infoserveindia.com/products/25/Network-Surveillance-System.html). Internet Monitoring System: 1. Service based targeting system that decodes 100% of traffic before filtering.
2. Analyze Data flowing at 10 G/sec with less than 2% packet loss
3. A single system is responsible for delivery to different Law Enforcement Monitoring Facilities.
4. Deep Packet Inspection technology
5. Privacy concerns are met by ensuring that only targets relevant 
data is intercepted. The interception is done on the following 
parameters namely –
E-mail ID, the mail is sent fromE-Mail ID, the mail is sent toIP address of a Sub ISP to intercept all traffic from a suspicious networkThe keyword content in the mail.Landline Numbers of suspects
6. User Privileges and escalations attached to each officer and administrator
7. Link Analysis and Pattern matching on all captured data. Advantages: Intelligence gathering for an entire state or a region, Completely indigenous developed with scalable architecture and Infrastructure, Data loss of less than 2%, Build a chain of suspect from a single start point, 2nd Generation interception System, All privacy concerns are met and maintained by the product automatically, Advanced link analysis and pattern matching algorithms, Completely Automated system, Data processing of up to 10 G /s, Automated alerts on capture of suspicious data (http://infoserveindia.com/products/26/Internet-Monitoring-System.html). ","Call Data Record (CDR) Miner application: View link for features: http://infoserveindia.com/products/24/CDR-Mining.html. Internet Monitoring System: Link Analysis and Pattern matching on all captured data, Build a chain of suspect from a single start point, Advanced link analysis and pattern matching algorithms, Data processing of up to 10 G /s, Automated alerts on capture of suspicious data (infoserveindia.com/products/26/Internet-Monitoring-System.html)",,,,,,,,,"Law enforcement agencies, intelligence agencies, police, governments",,An ISO 9001:2008 Certified Company and a NASSCOM member,http://infoserveindia.com/privacy_policy.html,"9, 8, -",4,,Website Privacy Policy: http://infoserveindia.com/privacy_policy.html
SilverStar Tracking Solutions,http://www.sstracking.com/,2008,,,"Mumbai, India",,"Plexitech Technologies Pvt Ltd.
511 Vardhaman Chambers
17G Cawasji Patel St 
Fort, Mumbai 400 001
India ", sales@sstracking.com, 00 91 22 42129000 ,@SSTracking,,Vehicle Trackers,,,,,,Compact Tracker SS70: http://www.sstracking.com/Common/Products/CompactTrackerSS70.aspx,,,,,The public,,,http://www.sstracking.com/Common/Footer/Privacy_Policy.aspx,5,1,,
Convexicon Software Solutions India Pvt. Ltd.,http://www.convexiconindia.com/,More than 2 years ago,,,"Gurgaon, India",,"38-Dakshin Marg, DLF Phase-II, Opposite Sahara Mall,
Gurgaon-122002 (Hr.)","info@convexiconindia.com, ask.hr@convexiconindia.com ","00 91 9958620044, 00 91 9911340044 ",@convexiconindia,,"Vehicle Tracking Systems (software and hardware), Biometric Access Control Systems, CCTV cameras",,,,,,"Smart Vehicle Tracker (SVT-22): http://www.convexiconindia.com/hardware/vehicle.html, ",,CCTV surveillance systems: http://www.convexiconindia.com/hardware/surveillance.html,,"Biometric Access Control System: The System is also known for   giving a professional fingerprint access 
as well as time attendance   control system. It also uses fingerprint 
rather than card system for the   access. This can also be extensively 
used in the Confidential Places   due to its easy installation as well 
as high security (http://www.convexiconindia.com/hardware/biometric.html)",Hotels and companies: http://www.convexiconindia.com/clients.html,,An ISO 9001: 2008 Certified Company,Privacy Statement: http://www.convexiconindia.com/Privacy-Statement.html,"1, 5, 6, -",2,,
 WSS Security Solutions Pvt Ltd,www.wssgroup.in,,,Mr. Harminder Singh,"Gurgaon, India",,"NH 8, Gurgaon, Haryana, India",wssharminder@gmail.com  ,00 91 9871373333,,,CCTV cameras,,,,,,,,"CCTV cameras: http://www.wssgroup.in/cctvcamera.html
",,,Haryana Police and companies: http://www.wssgroup.in/client.html,,,N/A,6,"2, 4, -",,North India’s first CCTV zone
Nice Deal,http://www.indiamart.com/nicedeal/spy-mobile-softwares.html,2010,,Ms. Paramjeet Kaur (Proprietor),"Haryana, India",,"No. 189 A, Sector 16
Panchkula - 134 109, Haryana, India",, 00 91 172 2586765,,,"Spy Hidden Cameras, GPS Trackers and Navigators, Call Monitoring Devices, Spy Wall Listening Devices, Spy Bluetooth Watches, Pen Drive Voice Recorders, 3G Wireless Cameras, Hidden Security Cameras, Spy Mobile Software",,,"Spy Cell Phone Interceptor Software: With the help of latest technology, we are able to offer Spy Cell Phone 
Interceptor software that is helps in managing calls by sending SMS on 
the pre-defined number to a cellular phone if a call is in progress on 
the target phone (incoming or outgoing). When the user calls the target 
phone, he will hear the conversation taking place on the target phone. 
To execute this application, call conferencing and call display is 
required. This software offered by us, transforms the mobile phone into a
 sophisticated surveillance device and spy phone thus, is highly 
demanded in the market (http://www.indiamart.com/nicedeal/spy-mobile-softwares.html)",,,"GPS Trackers code VT-001: Working Based on existing GSM/GPRS network and GPS satellites, this 
product can locate and monitor any remote targets by SMS or internet. 
this item include Latest GPS Tracker Software (http://www.indiamart.com/nicedeal/gps-trackers-navigators.html), GPS Tracking Device: Track exactly, track secretly. This GPS tracker can be used to determine
 the precise location of a vehicle, person, or other asset to which it 
is attached and to record the position of the asset at certain 
intervals (http://www.indiamart.com/nicedeal/gps-trackers-navigators.html)",,"Spy Pen Cameras: These spy cameras are widely appreciated for its unique feature such as 
very high resolution video recording, in built microphone, compact 
design, long duration recording and long service life. They are mainly 
used by reporters, journalists and researchers to cover deceptive 
operations for public awareness (http://www.indiamart.com/nicedeal/spy-hidden-cameras.html), Lighter Video Cameras: Made in Taiwan, includes PC camera function and records video with audio (http://www.indiamart.com/nicedeal/spy-hidden-cameras.html), Spy Coca-Cola Can Camera: These cameras are built-in Coca-Cola cans, which is a very casual type 
of camera used as a protection tool in daily life or as surveillance 
equipment especially (http://www.indiamart.com/nicedeal/spy-hidden-cameras.html), Wrist Watch Cameras: The Spy Wrist Watch Video Cameras are widely used for carrying out 
various sting operations by newspapers, television news channels, 
research based projects and many other organizations (http://www.indiamart.com/nicedeal/spy-hidden-cameras.html)",,,"The public - including journalists, researchers, organizations, etc. ",,,N/A,"10, 5, 6, -",1,,Some of the products include hidden security products (in wrist watches and spectacles)
Action India,http://www.spysystemsindia.co.in/HIMACHAL-PRADESH/index.html,,,,"New Delhi, India",,"H.0.2162/29 GURU ARJUN NAGAR OPP.
METRO PILLER NUMBER 230 
MAIN PATEL NAGAR ROAD
NEW DELHI-110008
NEAR SHADI PUR METRO STATION",actionindiadelhi@gmail.com,"00 91 9811601716, 00 91 9811251277",,,"Spy Cameras (including Spy Keychain Camera, Spy Glasses Camera, Spy Wrist Watch Camera, and many others), Spy Wireless Cameras (including Spy 3G Hidden Camera), 2-way GSM Audio Listening Device, Digital Voice Recorder, Spy USB Voice Recorder, Spy Wall Listening Device, Spy Voice Recorder Pen, Spy Hidden Mobile Battery GSM BUG, Spy Mobile Phone Software, Spy Key Logger, Spy GPS Tracker Watch Mobile, Spy Walky-talky Watches, Mobile Watch Phone, Spy Watch Mobile Phone, Spy GPS Vehicle Tracker, Spy GPS Personal Tracker, Spy GPS Mobile Tracker, Spy GPS Tracker Watch Mobile","Spy Keylogger: This device is connected between the computer and the keyboard. As the 
user types anything on the keyboard, such as emails, documents, 
passwords, etc, they are stored on an internal memory storage device 
within the keylogger. The owner of the keylogger can then retrieve the 
data from the keylogger at any time.There are 3 main types of hardware keylogger available. There is the 
PS/2 model, which has the same fittings as a standard PS/2 keyboard. 
There is also the USB model, which is compatible with all modern 
keyboards. The third type of keylogger is one concealed within the 
computer keyboard itself. This is the ultimate in stealth as its very 
unlikely that a user would regularly unscrew their keyboard to see if a 
keylogger has been installed inside it. Keylogging devices can also work
 with some wireless keyboards as long as the keylogger fits between the 
computer and the USB keyboard receiver (http://www.spysystemsindia.co.in/HIMACHAL-PRADESH/SPY-KEY-LOGGER-CODE-066.html) 
",,"Spy Mobile Phone Software code-029: This mobile phone looks and operates like any other mobile phone. It can dial out and receive calls like any other mobile phone. However we have put in special program which once activated, the SPY-Phone will let you know all the phone activity of the Phone user (http://www.spysystemsindia.co.in/HIMACHAL-PRADESH/SPY-MOBILE-PHONE-SOFTWARE-CODE-029.html)",,,"Spy GPS Vehicle Tracker code 137: Working Based on existing GSM/GPRS network and GPS satellites, this 
product can locate and monitor 
Any remote targets by SMS or internet. This item include Latest GPS 
Tracker Software(Latest Ver ) 
No Contract, No Activation Fee, No Software use Fee. 
More safety and convenience, by (running on a personal computer) remote 
control software can cut off the vehicle oil and the circuit, also can 
be connections the original vehicle are vibration sensors and automotive
 door control switch (http://www.spysystemsindia.co.in/HIMACHAL-PRADESH/SPY-GPS-VEHICLE-TRACKER-CODE-137.html), Spy GPS Mobile Tracker: This is a GPS high quality senior mobile phone.When the 
elderly+girl+child using it,you can track him by SMS or GPS paltform.And
 if in emergency,the elderly+girl+child can press SOS button to ask for 
help.It is the elderly's safety device.And it can one-key call the 
family members (http://www.spysystemsindia.co.in/HIMACHAL-PRADESH/SPY-GPS-MOBILE-TRACKER-CODE-139.html)",,"CCTV cameras (http://www.spysystemsindia.co.in/HIMACHAL-PRADESH/CCTV-FOR-SECURITY-CODE-014.html), Spy Wall Listening Device: Works on wooden walls, doors, windows, steel plates, etc. Spy Bug with earphones. Volume Dial to amplify sounds. 3.5mm Earphone Jack. USB included. ON/OFF Switch Button with volume Dial. Built In rechargeable battery (http://www.spysystemsindia.co.in/HIMACHAL-PRADESH/SPY-WALL-LISTENING-DEVICE-CODE-009.html), Spy Coca-Cola Can Camera: A Coca-Cola Can Wireless Hidden Video Camera system features the 
smallest pinhole camera in the world. This unique video camera system 
will operate indoors or outdoors and view clearly down a street or 
throughout a room while recording all the action direct to its built-in 
4GB DVR/Digital Video Recorder. Simply connect the Spy Can to any 
PC/Computer via USB cable to review footage. No drivers or software 
needed. This newly designed unit features built in video functions and 
real time recordings with no motion blurs or time delay. The built-in 
camera lens and audio microphone are virtually unnoticeable. Everything 
is easy to set up and connect within seconds. Quickly recharge the 
built-in lithium battery via USB cable (http://www.spysystemsindia.co.in/HIMACHAL-PRADESH/SPY-COCA-COLA-CAN-CAMERA-CODE-032.html), Spy Pen Camera: Made in Japan. Digital Spy Hidden pen camera cum pen drive 5.0 mega pixels camera 01 
YEAR Guarantee.This Micro-Cam recorder is a super compact video audio 
camcorder (http://www.spysystemsindia.co.in/HIMACHAL-PRADESH/SPY-PEN-CAMERA-CODE-034.html),Spy Reverse Gogles: Spy Glasses look like an ordinary pair of sun glasses.Yet they have a unique feature: you can see behind you. The lenses on these spy glasses have a special coating that allows you to look straight ahead and still see what is going on behind you (http://www.spysystemsindia.co.in/HIMACHAL-PRADESH/SPY-REVERSE-GOGGLES-CODE-048.html), Spy wireless cameras (http://www.spysystemsindia.co.in/HIMACHAL-PRADESH/WIRELESS-CAMERA.html)",,,The public (products sold online) - possibly law enforcement agencies as well,,,N/A,"6, 9, 10, 5, -",1,,"Action India imports products directly from Taiwan, Russia, Israel and China"
Verint Systems,http://verint.com/,1994,,Dan Bodner,"Melville, NY","Verint Systems Inc.
 330 South Service Road
 Melville, NY 11747 USA","Verint Systems India Pvt. Ltd, 58, 6th Floor, H M Tower, Brigade Road
Bangalore, Karnataka, India, 560001
","info@verint.com, marketing.apac@verint.com, HD_India@verint.com ","00 1 631 962 9600 (USA), 00 91 80 41993000 (India) ",@Verint,ISS World Europe 2014: http://www.issworldtraining.com/iss_europe/,"Impact 360 Speech Analytics, Impact 360 Text Analytics, Nextiva Video Management Software (VMS), Nextiva Physical Security Information Management (PSIM), Nextiva Network Video Recorders (NVRs), Nextiva Video Business Intelligence (VBI), Nextiva Surveillance Analytics, Nextiva IP cameras,  CYBERVISION Network Security, ENGAGE suite, FOCAL-INFO (FOCAL-COLLECT & FOCAL-ANALYTICS), RELIANT, STAR-GATE, VANTAGE, Audiolog for Public Safety, Impact 360 for Public Safety","CYBERVISION Network Security: The Verint CYBERVISION Network Security portfolio provides superior malware detection capabilities for high-speed networks, including national backbones, and is built on more 
than two decades of Verint experience implementing large network monitoring projects for government organizations worldwide (http://www.verint.com/solutions/communications-cyber-intelligence/products/cybervision/index.html),  FOCAL-INFO: The end-to-end Verint FOCAL-INFO solution applies the latest open-source Web intelligence methodologies to continuously search a multitude of open Web sources, extract and analyze public information that they contain, and transform it into actionable intelligence.Usingthe most advanced technologies available today, Verint FOCAL-INFO streamlines the integration of vast amounts of open-source Web data, generates new leads, and tracks negative influencers, thus optimizing the investigation process. Verint FOCAL-COLLECT covertly collects large volumes of open-source data from virtually any public Web site. Verint FOCAL-ANALYTICS transforms volumes of open-source data into meaningful information and indicates new sources for intelligence gathering (http://www.verint.com/solutions/communications-cyber-intelligence/products/focal-info/index), RELIANT: RELIANT intercepts, filters, and analyzes target communications from voice, Internet, mobile  and fixed satellite, and cellular  communications in compliance with lawful interception mandates (http://www.verint.com/solutions/communications-cyber-intelligence/products/reliant/index), STAR-GATE: Designed to manage vast numbers of targets, concurrent sessions and networks, STAR-GATE transparently accesses targeted communications 
without alerting subscribers or disrupting service.Using STAR-GATE, service providers can deploy a single, centralized solution to address a variety of technologies and compliance regulations in any number of countries. This eliminates the burden of deploying a different
compliance solution in every country in which a provider offers communication services (http://www.verint.com/solutions/communications-cyber-intelligence/products/star-gate/index), VANTAGE: VANTAGE intercepts, filters, and analyzes mass and target communications from traditional voice, Internet, mobile and fixed satellite, and cellular communicationsin compliance with lawful interception mandates. This robust monitoring center helps intelligence, national security, and other government agencies generate high-quality intelligence from huge volumes of data to unearth threats and track targets. VANTAGE  monitoring centers provide real-time interception and retrospective analysis of huge volumes of mass or target communications (http://www.verint.com/solutions/communications-cyber-intelligence/products/vantage/index)","Impact 360 for Public Safety: (1) Analyze captured audio to identify clues or surface trends that might otherwise go undetected, (2) Capture and retrieve audio, video, text, screen data, telematics, photos, maps, and related data, such as telephone numbers and locations,from a variety of sources, (http://www.verint.com/solutions/public-safety/products/Impact-360-for-Public-Safety/index), Nextiva Video Management Software (VMS): Nextiva Video Management Software (VMS) streamlines video security operations and helps you rapidly make sense of the vast volumes of video and data you capture (http://www.verint.com/solutions/video-situation-intelligence/products/video-management-software/index.html), Nextiva PSIM: Nextiva PSIM captures information from a variety of security, safety, and building management systems, enables the fusion of the information for a user to view, correlate, and analyze the information to identify situations quickly and efficiently, and initiate and manage response to the situations in collaboration with local agencies (http://www.verint.com/solutions/video-situation-intelligence/products/physical-security-management/index), Nextiva Video Business Intelligence (VBI): Nextiva Video Business Intelligence (VBI) is a comprehensive solution that helps forward-thinking retail organizations capture and analyze shopper movement patterns in order to increase conversion rates, improve operational efficiency and maximize customer satisfaction. Nextiva VBI expands the application of video security infrastructure by using video 
from existing surveillance cameras to extract accurate and holistic data
 about customer behavior patterns; more than what traditional 
technologies produce (http://www.verint.com/solutions/video-situation-intelligence/products/video-business-intelligence/index)","ENGAGE solutions: ENGAGE solutions intercept, decode, monitor, and analyze communications 
in field operations. These covert, portable solutions target specific 
networks and applications, with off-air interception and location 
solutions for GSM, UMTS, and mobile satellite networks (http://www.verint.com/solutions/communications-cyber-intelligence/products/engage/index), RELIANT: RELIANT intercepts, filters, and analyzes target communications from voice, Internet, mobile  and fixed satellite, and cellular  communications in compliance with lawful interception mandates (http://www.verint.com/solutions/communications-cyber-intelligence/products/reliant/index), VANTAGE: VANTAGE intercepts, filters, and analyzes mass and target communications from traditional voice, Internet, mobile and fixed satellite, and cellular communications in compliance with lawful interception mandates. This robust monitoring center helps intelligence, national security, and other government agencies generate high-quality intelligence from huge volumes of data to unearth threats and track targets (http://www.verint.com/solutions/communications-cyber-intelligence/products/vantage/index), Audiolog for Public Safety: provides full-time recording, selective recording, recording on demand, and dial-in recording across digital and analog telephones, trunked and conventional radio systems, telephone lines and trunks, IP phones, short
 message service (SMS), and PC screens. In addition to recording 
interactions, Audiolog can tag them with information from radio, 
ANI/ALI, CTI, ICCS, CAD, SMS, and GIS systems to facilitate incident 
reconstruction (http://www.verint.com/solutions/public-safety/products/audiolog-for-public-safety/index)","Impact 360 Speech Analytics: With Impact 360 Speech Analytics, you can glean valuable intelligence 
from thousands—even millions—of customer calls quickly, so you can take 
action quickly (http://www.verint.com/solutions/voice-of-the-customer-analytics/Products/speech-analytics/index)",,,"Nextiva Surveillance Analytics: Nextiva Surveillance Analytics helps organizations make sense of vast amounts of security video and data, generating Actionable Intelligence for better decisions and faster, more effective action. This powerful suite of integrated analytic applications can automatically pinpoint potential breaches and significant events and send video alerts to the appropriate people, departments and agencies (http://www.verint.com/solutions/video-situation-intelligence/products/surveillance-analytics/index), Impact 360 Text Analytics: collects, analyzes, and acts on customer interactions from a variety of text-based communication channels, including Facebook and Twitter (http://www.verint.com/solutions/voice-of-the-customer-analytics/Products/text-analytics/index)","Nextiva Network Video Recorders (NVRs): Nextiva network video recorders (NVRs) capture high-quality video images and adapt to evolving security needs.These NVRs include flexible storage and management options with Verint’s enterprise-class video viewing and automated monitoring software (http://www.verint.com/solutions/video-situation-intelligence/products/network-video-recorders/index), Nextiva IP cameras: Nextiva helps organizations address the challenges of indoor and outdoor video surveillance with a wide array of powerful IP cameras (http://www.verint.com/solutions/video-situation-intelligence/products/ip-cameras/index.html) ",,,"Governments, military, law enforcement agencies, companies, organisations, intelligence agencies","RELIANT intercepts and delivers communication in compliance with ETSI, CALEA, and other worldwide lawful interception standards and regulations (http://www.verint.com/solutions/communications-cyber-intelligence/products/reliant/index), STAR-GATE is in compliance with lawful interception mandates worldwide, including ETSI, CALEA , 3GPP, CableLabs, and others.  ","ISO 9001:2008, ISO 27001:2007, ISO 14001:2004 (http://www.verint.com/about/corporate-responsibility/iso-certifications/index.html) ",http://www.verint.com/about/legal/privacy-policy/index,"9, 8, 10, 4, 7, 6, -","2, 4, -",Verint to get government contract for interception tools: http://articles.economictimes.indiatimes.com/2013-07-27/news/40833490_1_interception-solution-cyber-security-interception-tools,"Revenue FYE January 31, 2013: $848 million"
